{
  "$schema": "https://json-schema.org/draft/2020-12/schema",
  "$id": "item.schema.json",
  "title": "Reval Rebel item content",
  "type": "object",
  "additionalProperties": false,
  "required": [
    "type",
    "id",
    "name",
    "category",
    "confidence",
    "canon_status",
    "approval",
    "gameplay",
    "source_notes"
  ],
  "properties": {
    "type": {
      "const": "item"
    },
    "id": {
      "$ref": "common.schema.json#/$defs/content_id"
    },
    "name": {
      "type": "string",
      "minLength": 1
    },
    "icon": {
      "type": "string",
      "description": "Relative path to the item icon texture (e.g. 'res://assets/UI/inventory/forge_hammer.png'). Optional."
    },
    "category": {
      "type": "string",
      "enum": [
        "quest_tool",
        "evidence",
        "commission_object",
        "material",
        "weapon",
        "supply"
      ]
    },
    "confidence": {
      "$ref": "common.schema.json#/$defs/confidence_label"
    },
    "canon_status": {
      "$ref": "common.schema.json#/$defs/canon_status"
    },
    "approval": {
      "$ref": "common.schema.json#/$defs/review_record"
    },
    "owner_id": {
      "$ref": "common.schema.json#/$defs/content_id"
    },
    "location_id": {
      "$ref": "common.schema.json#/$defs/content_id"
    },
    "material_grade": {
      "type": "string",
      "enum": [
        "none",
        "poor",
        "common",
        "fine"
      ]
    },
    "gameplay": {
      "type": "object",
      "additionalProperties": false,
      "required": [
        "visible_in_pouch",
        "stackable",
        "uses"
      ],
      "properties": {
        "visible_in_pouch": {
          "type": "boolean"
        },
        "stackable": {
          "type": "boolean"
        },
        "uses": {
          "type": "array",
          "items": {
            "type": "string",
            "minLength": 1
          }
        },
        "equip": {
          "type": "object",
          "additionalProperties": false,
          "required": [
            "slot"
          ],
          "properties": {
            "slot": {
              "type": "string",
              "enum": [
                "right_hand",
                "left_hand",
                "head",
                "back"
              ]
            },
            "scene": {
              "type": "string",
              "pattern": "^res://.+\\.tscn$"
            },
            "world_scene": {
              "description": "Optional scene shown while the item lies or leans in the world (WorldItemView); defaults to the held scene.",
              "type": "string",
              "pattern": "^res://.+\\.tscn$"
            },
            "garment": {
              "type": "string",
              "minLength": 1
            }
          }
        },
        "carry": {
          "type": "object",
          "additionalProperties": false,
          "required": [
            "weight_g",
            "grid_width",
            "grid_height"
          ],
          "properties": {
            "weight_g": {
              "type": "integer",
              "minimum": 1
            },
            "grid_width": {
              "type": "integer",
              "minimum": 1,
              "maximum": 8
            },
            "grid_height": {
              "type": "integer",
              "minimum": 1,
              "maximum": 5
            }
          }
        },
        "pickup": {
          "type": "object",
          "additionalProperties": false,
          "properties": {
            "bark_pool_id": {
              "$ref": "common.schema.json#/$defs/content_id"
            },
            "speaker_id": {
              "$ref": "common.schema.json#/$defs/content_id"
            },
            "comment": {
              "type": "string",
              "minLength": 1
            },
            "sfx_id": {
              "$ref": "common.schema.json#/$defs/content_id"
            }
          }
        },
        "attack_profile": {
          "$ref": "item.schema.json#/$defs/attack_profile"
        },
        "charged_attack_profile": {
          "$ref": "item.schema.json#/$defs/attack_profile"
        },
        "charge_threshold_sec": {
          "type": "number",
          "exclusiveMinimum": 0
        },
        "weapon_class": {
          "description": "Player move set (docs/SYSTEMS/COMBAT_ANIMATION.md). Presentation and per-step multipliers only; damage stays in attack_profile.",
          "enum": ["unarmed", "hammer", "sword", "spear", "axe", "bow"]
        },
        "two_handed": {
          "description": "Needs both hands: equipping it returns the other hand's item to the bag (GameState.equip_from_bag).",
          "type": "boolean"
        },
        "ranged": {
          "description": "Missile weapon (weapon_class bow): the strike looses a deterministic arrow on the logic plane instead of a melee pulse (docs/SYSTEMS/COMBAT.md).",
          "type": "object",
          "additionalProperties": false,
          "required": ["range_px", "speed_px_per_sec"],
          "properties": {
            "range_px": {
              "type": "number",
              "exclusiveMinimum": 0
            },
            "speed_px_per_sec": {
              "type": "number",
              "exclusiveMinimum": 0
            }
          }
        },
        "shield_guard": {
          "description": "Shield carried in the off hand: replaces the bearer's guard numbers while it is equipped (docs/SYSTEMS/COMBAT.md).",
          "type": "object",
          "additionalProperties": false,
          "required": ["guard_stamina_per_damage", "parry_window_sec"],
          "properties": {
            "guard_stamina_per_damage": {
              "type": "number",
              "minimum": 0
            },
            "parry_window_sec": {
              "type": "number",
              "minimum": 0
            }
          }
        }
      }
    },
    "source_notes": {
      "type": "array",
      "minItems": 1,
      "items": {
        "$ref": "common.schema.json#/$defs/source_note"
      }
    }
  },
  "$defs": {
    "attack_profile": {
      "type": "object",
      "additionalProperties": false,
      "required": [
        "animation",
        "damage",
        "reach_px",
        "impact_timing_sec",
        "stamina_cost",
        "damage_type"
      ],
      "properties": {
        "animation": {
          "type": "string",
          "minLength": 1
        },
        "damage": {
          "type": "number",
          "exclusiveMinimum": 0
        },
        "reach_px": {
          "type": "number",
          "exclusiveMinimum": 0
        },
        "facing_dot": {
          "type": "number",
          "minimum": -1,
          "maximum": 1
        },
        "impact_timing_sec": {
          "type": "number",
          "exclusiveMinimum": 0
        },
        "attack_duration_sec": {
          "type": "number",
          "exclusiveMinimum": 0
        },
        "stamina_cost": {
          "type": "number",
          "minimum": 0
        },
        "damage_type": {
          "type": "string",
          "enum": [
            "blunt",
            "pierce",
            "slash"
          ]
        }
      }
    }
  }
}
